ID,브랜드명,팝업스토어명,카테고리,세부카테고리,시작일,종료일,운영일수,위치,구역,원산지(원본),원산지(정제),콜라보,설명,연도,출처
646,ABC마트 x 나이키,ABC마트 x 나이키 에어맥스 'Above the Influence' 팝업,,신발,2026-03-27,2026-03-29,,서울 성동구 그랜드 스테이지 플래그십 성수 앞 야외공간,,한국/미국,한국/미국,ABC마트 x 나이키,"에어맥스95 핑크폼 글로벌 론칭 전 단독 선공개. 양말 꾸미기, 바지 밑단 커스터마이징 체험 프로그램.",,"['http://www.apparelnews.co.kr/news/news_view/?idx=222359', 'https://www.slist.kr/news/articleView.html?idxno=727100']"
647,ABC마트 x 아디다스,ABC마트 x 아디다스 '삼바 OG 사틴 팩' 팝업,,신발,2026-05-08,2026-05-17,,서울 성동구 그랜드 스테이지 플래그십 성수,,한국/독일,한국/독일,ABC마트 x 아디다스,삼바 OG 사틴 팩 단독 론칭 기념 팝업. 발레코어 무드의 부드러운 광택감 공간 연출.,,"['http://www.fi.co.kr/main/view.asp?idx=88104', 'https://www.newstap.co.kr/news/articleView.html?idxno=326638']"
648,아디다스,아디다스 성수 플래그십 스토어,,스포츠웨어/신발,2025-08-01,상설 운영,,서울 성동구 연무장길,,독일,독일,,"총 3층 규모의 플래그십 스토어. 삼바, 가젤, 스페지알 등 다양한 스니커즈 전시. 시티숍 존 운영.",2025,['https://blog.naver.com/PostView.naver?blogId=eblovebr0915&logNo=223965141159']
649,로아(ROA),로아 성수 팝업,,아웃도어/신발,2026-03-06,2026-03-18,,서울 성동구 연무장15길 11 EQL 성수 1층,,이탈리아,이탈리아,,이탈리아 알프스에서 영감 받은 아웃도어 브랜드. 트레킹 부츠와 기능성 아웃도어 신발 전시.,,['https://letter.wepick.kr/post/24469']
650,뉴프로젝트,뉴프로젝트 성수 팝업스토어,,디자이너 브랜드,2020-01-01,2020-12-31,,서울 성동구,,한국,국내,,뉴프로젝트의 성수동 팝업스토어.,2020,['https://www.youtube.com/watch?v=7gZfrE-SIGU']
651,비이커 x 살로몬,비이커 x 살로몬 팝업,,아웃도어/신발,2026-02-20,2026-03-12,,서울 성동구,,한국/프랑스,한국/프랑스,비이커 x 살로몬,"고프코어 트렌드의 살로몬 트레일화, 러닝화 팝업. 한정 컬러 제품 전시.",,['https://blog.naver.com/PostView.naver?blogId=davi-kim&logNo=224195315222']
652,나이키 x SKIMS,나이키 x SKIMS 팝업,,스포츠웨어,2026-02-26,2026-03-09,,서울 성동구 연무장5길 20,,미국,미국,나이키 x SKIMS,스포츠웨어와 바디라인 속옷 브랜드의 콜라보. 한정 컬렉션 전시 및 판매.,,['https://blog.naver.com/PostView.naver?blogId=davi-kim&logNo=224195315222']
653,디자이너 브랜드 집합 팝업,성수동 디자이너 브랜드 팝업,,디자이너 브랜드,2026-05-15,2026-05-17,,서울 성동구 스페이스 누디,,한국,국내,"THREADX, MANO seoul, Oblatt, A.rob, TOPPINGZ, PASS ME BY, OWN, ABT, DUDAL, Oesalang","주얼리, 가방, 향수, 패션의류까지 한 공간에서 만나볼 수 있는 디자이너 브랜드 집합 팝업.",,['https://www.threads.com/@dudal____/post/DX_ZL2EgM3T']
654,Misekiseoul,Misekiseoul x IVE 레이 팝업,,패션/액세서리,2026-05-01,2026-05-31,,서울 성동구 아차산로5길 24-14,,일본/한국,일본/한국,IVE 레이,일본-서울 패션 브랜드 Misekiseoul과 IVE 레이의 콜라보 팝업. 스파클링 걸스 월드 콘셉트.,,['https://insideseoul.app/seongsu/popups']
655,Anggae,Anggae x Iak 팝업,,여성의류,2026-05-01,2026-05-17,,서울 성동구 연무장길 스테이지 35,,한국,국내,Iak (도자기 스튜디오),한국 여성복 브랜드 Anggae와 도자기 스튜디오 Iak의 협업 팝업.,,['https://insideseoul.app/seongsu/popups']
656,브랜디멜빌,브랜디멜빌 성수 매장,,캐주얼/여성,2025-01-01,상설 운영,,서울 성동구 연무장길,,이탈리아/미국,이탈리아/미국,,Z세대 여성 사이에서 인기 있는 하이틴 캐주얼 브랜드.,2025,['https://www.careet.net/1889']
657,KASINA,KASINA 성수 팝업,,스트리트웨어/신발,2025-01-01,2025-12-31,,서울 성동구,,한국,국내,,한국 대표 스트리트웨어 편집숍 KASINA의 성수 팝업.,2025,['https://www.youtube.com/watch?v=7gZfrE-SIGU']
658,아디다스 오리지널스,아디다스 오리지널스 플래그십 성수,,스트리트웨어/신발,2025-01-01,상설 운영,,서울 성동구,,독일,독일,,아디다스 오리지널스의 성수 플래그십 스토어.,2025,['https://www.youtube.com/watch?v=7gZfrE-SIGU']
659,PRTPRT SHOP,PRTPRT SHOP 성수,,디자이너 브랜드,2025-01-01,상설 운영,,서울 성동구,,한국,국내,,성수동의 디자이너 브랜드 편집숍.,2025,['https://www.youtube.com/watch?v=7gZfrE-SIGU']
660,블루엘리펀트,블루엘리펀트 성수 플래그십 스토어,,캐주얼,2025-01-01,상설 운영,,서울 성동구,,한국,국내,,블루엘리펀트의 성수 플래그십 스토어.,2025,['https://www.youtube.com/watch?v=7gZfrE-SIGU']
661,발렌티노,발렌티노 2025 가을 컬렉션 팝업,,명품/패션,2025-01-01,2025-12-31,,서울 성동구,,이탈리아,이탈리아,,발렌티노 2025 가을 컬렉션 팝업스토어. '르 샤 드 라 메종' 콘셉트.,2025,['https://www.tiktok.com/@marieclairekorea/video/7518953248208801041']
662,무신sa,무신sa 메가스토어 성수,,패션 편집숍,2026-04-24,상설 운영,,서울 성동구 성수동,,한국,국내,,"지하 1층부터 지상 4층까지 운영되는 대규모 패션 편집숍. 다양한 패션, 뷰티 브랜드 팝업 상시 운영.",,['https://v.daum.net/v/6iHs8unQUx']
663,무신sa,무신sa 시즌오프 팝업,,패션 편집숍,2026-01-01,2026-01-31,,서울 성동구,,한국,국내,,"골든선새인, 길라아카이브, 르파르, 비엘알 등 브랜드의 2025 FW 컬렉션 할인 판매.",,['https://www.seongsudonggorilla.com/article/514']
664,뉴-뉴(NEWNEU),뉴-뉴 성수 팝업스토어,,라이프스타일/패션잡화,2026-01-01,상설 운영,,서울 성동구 성수동,,한국,국내,,"트렌디한 액세서리, 패션잡화, 리빙 소품을 제안하는 라이프스타일 편집 브랜드.",,['https://blog.naver.com/PostView.naver?blogId=adsac&logNo=224211800320']
665,엔디피(NDP),엔디피 x 리아킴 팝업,,뷰티/패션,2026-04-03,2026-04-11,,서울 성동구 연무장길 65 LECT 성수,,한국,국내,리아킴,리아킴 장벽 버터밤 오프라인 최초 체험. 매시간 럭키드로우 진행.,,['https://letter.wepick.kr/post/24851']
666,버버리,버버리 TB 모노그램 팝업,,명품/패션,2019-01-01,2019-12-31,,서울 성동구 마크 69,,영국,영국,,TB 모노그램 프린트로 카페 외벽을 랩핑한 팝업. 인테리어 효과의 강렬한 브랜딩.,2019,['https://www.exclosetshop.com/trendnews/?bmode=view&idx=11301505']
667,보테가베네타,보테가베네타 위드로브 02 팝업,,명품/패션,2021-01-01,2021-12-31,,서울 성동구,,이탈리아,이탈리아,,2021 가을 컬렉션 런칭 기념 성수동 건축물 랩핑 및 포스터 팝업.,2021,['https://www.exclosetshop.com/trendnews/?bmode=view&idx=11301505']
668,펜필드,펜필드 성수 팝업,,아웃도어/캐주얼,2025-07-01,2025-07-31,,서울 성동구,,미국,미국,,펜필드 아웃도어 캐주얼 브랜드 팝업.,2025,['https://blog.naver.com/gksk3232/223918803035']
669,헌처(HUNCHER),헌처 성수 팝업,,디자이너 브랜드,2025-07-01,2025-07-31,,서울 성동구,,한국,국내,,헌처 디자이너 브랜드 성수 팝업.,2025,['https://blog.naver.com/gksk3232/223918803035']
670,파이시스(PHYSIS),파이시스 성수 팝업,,디자이너 브랜드,2025-07-01,2025-07-31,,서울 성동구,,한국,국내,,파이시스 브랜드 성수 팝업.,2025,['https://blog.naver.com/gksk3232/223918803035']
671,베이컨트 아카이브,베이컨트 아카이브 성수 팝업,,디자이너 브랜드,2025-07-01,2025-07-31,,서울 성동구,,한국,국내,,베이컨트 아카이브 브랜드 성수 팝업.,2025,['https://blog.naver.com/gksk3232/223918803035']
672,올빼미 상점,올빼미 상점 성수 팝업,,디자이너 브랜드,2025-07-01,2025-07-31,,서울 성동구,,한국,국내,,올빼미 상점 브랜드 성수 팝업.,2025,['https://blog.naver.com/gksk3232/223918803035']
673,OIOI,OIOI x 바세린 컬러 립 팝업,,스트리트웨어/뷰티,2026-02-28,2026-03-08,,서울 성동구 연무장7길 16,,한국,국내,바세린,OIOI 스트리트 무드와 바세린 컬러 립밤의 콜라보 팝업. 체험형 공간.,,['https://blog.naver.com/PostView.naver?blogId=davi-kim&logNo=224195315222']
674,Nike x SKIMS,Nike x SKIMS 팝업 스토어,,스포츠웨어,2026-02-26,2026-03-09,,서울 성동구 연무장5길 20,,미국,미국,Nike x SKIMS,스포츠웨어와 애슬레저 브랜드의 콜라보. 한정 컬렉션 전시 및 판매.,,['https://blog.naver.com/PostView.naver?blogId=davi-kim&logNo=224195315222']
675,무신sa,무신sa 뷰티 페스타 인 성수,,뷰티/패션,2024-09-06,2024-09-09,,"서울 성동구 일대 (토탈존, 포인트존, 맨즈존)",,한국,국내,,"41개 브랜드 참여 대규모 뷰티 팝업. 기초, 색조, 프래그런스, 맨즈뷰티 등 3개 존 운영.",2024,['https://newsroom.musinsa.com/newsroom-menu/2024-0812']
676,무신sa,무신sa 뷰티 페스타 인 성수,,뷰티/패션,2025-09-16,2025-09-18,,"서울 성동구 무신sa 스퀘어 성수4, 뷰티 스페이스1, 스토어 성수@대림창고",,한국,국내,,45개 라이징 브랜드 참여. 무신sa 뷰티 단독 상품 67종 체험.,2025,['https://www.yna.co.kr/view/AKR20250501039700030']
677,Blackpink,Blackpopup [DEADLINE] 팝업,,아이돌 굿즈/패션,2026-02-28,2026-03-08,,서울 성동구 무신sa 스탠다드 성수,,한국,국내,,"블랙핑크 테마 팝업. 한정 MD 판매, 콘셉트 포토존, 굿즈 전시.",,['https://blog.naver.com/PostView.naver?blogId=davi-kim&logNo=224195315222']
678,디올,디올 성수 크루즈 컬렉션 전시,,명품/패션,2024-01-01,2024-12-31,,서울 성동구 연무장5길 7 디올 성수,,프랑스,프랑스,,"2024 크루즈 컬렉션 전시. 멕시코 문화의 아름다움을 담은 나비 자수 가방, 스카프, 액세서리 전시.",2024,['https://www.theden.co.kr/news/articleView.html?idxno=2052']
679,샤넬,샤넬 조향 마스터클스 성수,,명품/뷰티,2023-12-01,2023-12-31,,서울 성동구,,프랑스,프랑스,,샤넬 향수 라인 체험 및 조향 마스터클스. 나만의 향 찾기 서비스 제공.,2023,['https://www.theden.co.kr/news/articleView.html?idxno=2052']
680,메종 마르지엘라,메종 마르지엘라 전시,,명품/전시,2023-02-08,2023-03-26,,서울 송파구 올림픽로 300 롯데월드타워 7층,,프랑스,프랑스,,"디자이너 마틴 마르지엘라의 예술, 물질과 신체, 성별 관념 등을 탐구한 전시.",2023,['https://ohou.se/advices/8506']
681,크림(CRÉME),크림 성수 팝업,,디자이너 브랜드,2022-01-01,2022-12-31,,서울 성동구,,한국,국내,,크림 브랜드의 성수동 팝업스토어.,2022,['https://www.youtube.com/watch?v=7gZfrE-SIGU']
682,에메 레옹도르,에메 레옹도르 성수 팝업,,명품/액세서리,2022-01-01,2022-12-31,,서울 성동구,,프랑스,프랑스,,프랑스 럭셔리 액세서리 브랜드 에메 레옹도르의 성수 팝업.,2022,['https://www.youtube.com/watch?v=7gZfrE-SIGU']
683,우영미,우영미 성수 팝업/쇼룸,,디자이너 브랜드,2021-01-01,상설 운영,,서울 성동구,,한국,국내,,한국 디자이너 브랜드 우영미의 성수 쇼룸.,2021,['https://stibee.com/api/v1.0/emails/share/p4Uqfng7PqnqzK_3W7JbQhqKpd4-9A==']
684,마뗑킴,마뗑킴 성수 '하우스바이' 쇼룸,,디자이너 브랜드,2022-01-01,상설 운영,,서울 성동구,,한국,국내,,"마뗑킴의 성수 하우스바이 쇼룸. 롯데백화점 본점, 현대백화점 판교점 등에 이은 오프라인 매장 확장.",2022,['https://www.thereport.co.kr/news/articleView.html?idxno=23918']
685,송지오,송지오 성수 팝업/쇼룸,,디자이너 브랜드,2021-01-01,상설 운영,,서울 성동구,,한국,국내,,한국 디자이너 브랜드 송지오의 성수 쇼룸.,2021,['https://stibee.com/api/v1.0/emails/share/p4Uqfng7PqnqzK_3W7JbQhqKpd4-9A==']
686,아워레가시,아워레가시 성수 팝업,,디자이너 브랜드,2022-09-01,2022-09-30,,서울 성동구,,스웨덴,스웨덴,,"스웨덴 패션 브랜드 아워레가시의 국내 팝업. BTS 뷔, 이동휘 등 착용으로 인기.",2022,['https://www.thereport.co.kr/news/articleView.html?idxno=23918']
687,앵글게(Anggae),앵글게 x Iak 도자기 팝업,,여성의류/도자기,2026-05-01,2026-05-17,,서울 성동구 연무장길 스테이지 35,,한국,국내,Iak,여성복 브랜드 앵글게와 도자기 스튜디오 Iak의 협업 팝업. '작은 움직임의 아름다움' 콘셉트.,,['https://insideseoul.app/seongsu/popups']
688,무신sa,무신sa 뷰티 페스타 인 성수 (2025 하반기),,뷰티/패션,2025-08-18,2025-08-24,,서울 성동구 무신sa 스퀘어 성수4,,한국,국내,,40개 브랜드와 함께하는 하반기 뷰티 페스타. 이너뷰티 카테고리 확장.,2025,['https://newsroom.musinsa.com/newsroom-menu/2025-0818']
689,예일(Yale),예일 성수 팝업,,캐주얼,2020-01-01,2020-12-31,,서울 성동구,,한국,국내,,캐주얼 브랜드 예일의 성수 팝업스토어.,2020,['https://m.sedaily.com/amparticle/13353026']
690,커스텀멜로우,커스텀멜로우 성수 플래그십,,남성복,2022-01-01,상설 운영,,서울 성동구,,한국,국내,,코오롱FnC의 남성복 브랜드 커스텀멜로우의 성수 플래그십 매장. 홍대에서 성수로 이전.,2022,['https://m.sedaily.com/amparticle/13353026']
691,EQL,EQL 성수 팝업 공간,,패션 편집숍,2023-01-01,상설 운영,,서울 성동구 연무장15길 11,,한국,국내,,현대백화점그룹의 패션 편집숍 EQL 성수. 다양한 브랜드 팝업 진행.,2023,['https://letter.wepick.kr/post/24469']
692,핍스(PEEP),핍스 성수 팝업,,가방/액세서리,2025-01-01,2025-12-31,,서울 성동구,,한국,국내,,핍스 가방 브랜드의 성수 팝업.,2025,[]
693,프루아,프루아 성수 쇼룸,,가죽/액세서리,2015-01-01,상설 운영,,서울 성동구,,한국,국내,,가죽 제품을 주로 취급하는 디자이너 잡화 브랜드. 2015년부터 성수에 자리 잡음.,2015,['https://stibee.com/api/v1.0/emails/share/p4Uqfng7PqnqzK_3W7JbQhqKpd4-9A==']
694,레이크넨,레이크넨 성수 쇼룸,,가죽/액세서리,2015-01-01,상설 운영,,서울 성동구,,한국,국내,,가죽 제품 디자이너 브랜드. 2015년부터 성수에 자리 잡음.,2015,['https://stibee.com/api/v1.0/emails/share/p4Uqfng7PqnqzK_3W7JbQhqKpd4-9A==']
695,율이에,율이에 성수 쇼룸,,가죽/액세서리,2015-01-01,상설 운영,,서울 성동구,,한국,국내,,가죽 제품 디자이너 브랜드. 2015년부터 성수에 자리 잡음.,2015,['https://stibee.com/api/v1.0/emails/share/p4Uqfng7PqnqzK_3W7JbQhqKpd4-9A==']
696,페넥,페넥 성수 쇼룸,,가죽/액세서리,2015-01-01,상설 운영,,서울 성동구,,한국,국내,,가죽 소품 디자이너 브랜드. 2015년부터 성수에 자리 잡음.,2015,['https://stibee.com/api/v1.0/emails/share/p4Uqfng7PqnqzK_3W7JbQhqKpd4-9A==']
697,아르케이(ARCAY),아르케이 성수 팝업,,디자이너 브랜드,2023-01-01,2023-12-31,,서울 성동구,,한국,국내,,아르케이 디자이너 브랜드의 성수 팝업.,2023,[]
698,비앙카(BIANCA),비앙카 성수 팝업,,여성의류,2023-01-01,2023-12-31,,서울 성동구,,한국,국내,,비앙카 여성복 브랜드의 성수 팝업.,2023,[]
699,드로우(DRAW),드로우 성수 팝업,,디자이너 브랜드,2023-01-01,2023-12-31,,서울 성동구,,한국,국내,,드로우 디자이너 브랜드의 성수 팝업.,2023,[]
700,캐주얼 패션 브랜드 집합,성수동 패션 팝업스토어 5곳,,패션 종합,2026-02-01,2026-03-31,,서울 성동구 일대,,한국/글로벌,한국/글로벌,,"성수동에서 동시에 진행된 다양한 패션 팝업. OIOI, Nike x SKIMS, Blackpink, 비이커x살로몬 등.",,['https://blog.naver.com/PostView.naver?blogId=davi-kim&logNo=224195315222']
701,ABC마트,ABC마트 '나의 N번째 신상' 팝업,,신발 편집숍,2025-12-01,2025-12-31,,서울 성동구 (그랜드 스테이지 성수 오픈 전),,한국,국내,,ABC마트의 성수동 첫 팝업. 다양한 브랜드 신발 체험 공간.,2025,['http://www.apparelnews.co.kr/news/news_view/?idx=222359']
702,ABC마트 x 아디다스,ABC마트 x 아디다스 겨울 캠핑 팝업,,신발/스포츠웨어,2025-12-01,2026-01-18,,서울 성동구 (그랜드 스테이지 성수 2층),,한국/독일,한국/독일,ABC마트 x 아디다스,'낯선 조합이 더 재밌잖아' 슬로건의 겨울 캠핑 콘셉트 팝업.,2025,['http://www.apparelnews.co.kr/news/news_view/?idx=222359']
703,디오스피스,디오스피스 바울더리 성수 팝업,,스트리트웨어,2025-10-01,2025-10-31,,서울 성동구 성수이로 78 바울더리 성수,,한국,국내,,디오스피스의 바울더리 성수 팝업. 감각적인 아일렛 스터드 라인 인기.,2025,['https://fashionbiz.co.kr/article/221735']
704,MUSH,MUSH 빈티지 패션 팝업,,빈티지 패션,2025-12-29,2025-12-31,,서울 성동구 무신sa 본사,,한국,국내,무신sa,대전 기반 빈티지 패션 브랜드 MUSH의 무신sa 협업 팝업.,2025,['https://www.m-joongang.com/news/articleView.html?idxno=401934']
705,입생로랑 뷰티,입생로랑 뷰티 러브스토어 팝업,,명품/뷰티,2026-05-09,2026-05-24,,서울 성동구 연무장길,,프랑스,프랑스,,입생로랑 뷰티의 캔디 코디드 팝업. 파스텔 핑크 쇼핑 공간 연출.,,['https://insideseoul.app/seongsu/popups']
706,메종키츠네,메종키츠네 아더에러 팝업 카페,,라이프스타일/패션,2018-04-06,2018-10-06,,서울 마포구 아더에러 홍대 플래그십스토어,,프랑스/한국,프랑스/한국,아더에러 x 메종키츠네,café kitsuné X ADER pop-up café. 약 6개월간 운영.,2018,['http://www.koreafashion.org/lounge/fashion/read.jsp?reqPageNo=305&scategory_fk=1&no=17139']
707,이스트로프(EASTLOPE),이스트로프 성수 팝업,,디자이너 브랜드,2021-01-01,2021-12-31,,서울 성동구,,한국,국내,,이스트로프 디자이너 브랜드의 성수 팝업스토어.,2021,[]
708,아카이브앱크,아카이브앱크 성수 쇼룸,,디자이너 브랜드,2020-01-01,상설 운영,,서울 성동구,,한국,국내,,아카이브앱크 디자이너 브랜드의 성수 쇼룸.,2020,['https://stibee.com/api/v1.0/emails/share/p4Uqfng7PqnqzK_3W7JbQhqKpd4-9A==']
709,유어 네임 히어,유어 네임 히어 성수 쇼룸,,디자이너 브랜드,2020-01-01,상설 운영,,서울 성동구,,한국,국내,,유어 네임 히어 브랜드의 성수 쇼룸 오픈.,2020,['https://stibee.com/api/v1.0/emails/share/p4Uqfng7PqnqzK_3W7JbQhqKpd4-9A==']
710,마하그리드,마하그리드 성수 팝업,,캐주얼,2021-01-01,2021-12-31,,서울 성동구,,한국,국내,,마하그리드 2021 SS 컬렉션 '팀 마하그리드' 팝업.,2021,['https://www.musinsa.com/app/video/views/2791?contentCategoryCode=011002']
711,카사블랑카(Casablanca),카사블랑카 성수 팝업,,디자이너 브랜드,2022-01-01,2022-12-31,,서울 성동구,,프랑스,프랑스,,프랑스 디자이너 브랜드 카사블랑카의 성수 팝업.,2022,[]
712,엠플레이그라운드,엠플레이그라운드 성수 패션 팝업,,패션 놀이터,2025-05-01,2025-05-15,,서울 성동구 성수동2가 315-108,,한국,국내,아디다스,성수동 패션 놀이터 엠플레이그라운드. 아디다스 콘필름앱 행사 진행.,2025,['https://www.tiktok.com/@pickstival/video/7549854735319272722']
713,Misekiseoul,Misekiseoul 성수 팝업,,패션/액세서리,2026-05-01,2026-06-01,,서울 성동구 아차산로5길 24-14,,일본/한국,일본/한국,IVE 레이,Tokyo-Seoul 패션 브랜드 Misekiseoul의 IVE 레이 콜라보 팝업. 스파클링 걸스 월드 콘셉트.,,['https://insideseoul.app/seongsu/popups']
714,디자이너 브랜드 집합,성수동 디자이너 브랜드 팝업,,디자이너 브랜드 종합,2026-05-15,2026-05-17,,서울 성동구 스페이스 누디,,한국,국내,"THREADX, MANO seoul, Oblatt, A.rob, TOPPINGZ, PASS ME BY, OWN, ABT, DUDAL, Oesalang","주얼리, 가방, 향수, 패션의류까지 한 공간에서 만나볼 수 있는 디자이너 브랜드 집합 팝업.",,['https://www.threads.com/@dudal____/post/DX_ZL2EgM3T']
715,로아(ROA),로아 EQL 성수 팝업,,아웃도어/신발,2026-03-06,2026-03-18,,서울 성동구 연무장15길 11 EQL 성수 1층,,이탈리아,이탈리아,,이탈리아 알프스 영감의 아웃도어 브랜드. 트레킹 부츠와 기능성 신발 전시.,,['https://letter.wepick.kr/post/24469']
716,오버랩스(OVERLAPS),OVERLAPS X OFF BEAUTY POP-UP,,스킨케어,2026-05-12,2026-06-10,,오프뷰티 성수 메가팩토리점,,한국,국내,OFF BEAUTY,액티브 웰니스 스킨케어 브랜드 오버랩스의 팝업스토어. 브랜드 철학과 제품 경험을 직관적으로 전달하는 공간.,,['https://www.venturesquare.net/1081735/']
717,입생로랑 뷰티(YSL Beauty),YSL Beauty Lovestore Pop-up,,메이크업/향수,2026-05-09,2026-05-24,,성수동 연무장길,,프랑스,프랑스,,러브스토어 컬렉션 출시 기념 팝업. 핑크빛 달콤한 무드의 공간에서 신상 컬렉션 체험 및 쇼핑 카트 컨셉 이벤트.,,['https://popga.co.kr/popup/6471']
718,셀바티코(Selvatico),셀바티코 성수 팝업스토어,,바디케어/향수,2026-04-01,2026-05-31,,LCDC 서울 1층 DDMMYY,,프랑스,프랑스,,프랑스 헤리티지 기반 프래그런스 브랜드 팝업. 핸드 솔루션 신제품 2종 단독 선론칭. 향수 및 바디케어 레이어링 루틴 체험.,,"['http://www.cmn.co.kr/mobile/sub_view.asp?news_idx=49537', 'https://fashionbiz.co.kr/article/225061']"
719,갈더마(Galderma),스킨 SOS 위크(SKIN SOS WEEK),,스킨케어,2026-04-22,2026-04-26,,성수동 플라츠2,,스위스,스위스,"세타필, 레스틸렌, 엘크라넬","더마코스메틱 브랜드 통합 팝업. 피부 질환부터 안티에이징까지 맞춤형 솔루션과 피부과 전문의 강연, 뷰티 클래스 등 소비자 참여형 프로그램.",,['http://www.docdocdoc.co.kr/news/articleView.html?idxno=3038618']
720,나스(NARS),나스 NEW 파울데이션 팝업스토어,,메이크업,2026-03-08,2026-03-15,,"살롱 드 알럭스(Salon de R.LUX), 성수동 연무장길",,프랑스,프랑스,알럭스(R.LUX),"3년 만의 신상 '네츄럴 매트 롱웨어 파울데이션' 출시 기념. 1층 브랜드존 제품 테스트, 2층 뷰티 클래스(전소연 메이크업), 지하 칵테일 바 운영.",,['https://www.meconomynews.com/news/articleView.html?idxno=128812']
721,키엘(Kiehl's),키엘 울트라 응급 구조대 팝업,,스킨케어,2026-04-16,2026-04-26,,성수 연무장길,,미국,미국,,"신제품 '판테놀 함유 메디크림' 출시 기념. 피부 진단, 스킨 컨설팅, 제품 체험, 포토존 등 손상 피부 케어 메시지 전달.",,['https://www.meconomynews.com/news/articleView.html?idxno=129843']
722,라로슈포제(La Roche-Posay),UV 스타디움 팝업,,스킨케어/선케어,2026-05-15,2026-05-25,,성수동 연무장길,,프랑스,프랑스,,글로벌 더마코스메틱 선케어 1위 브랜드의 선케어 전문성 알리기. '안뗄리오스 선 플루이드' 체험 공간.,,['https://v.daum.net/v/20260512095105062']
723,롬앤(romand),롬앤 핑크오피스(Pink Office),,메이크업,2026-01-01,2026-12-31,,성수동 연무장길 88,,한국,국내,,롬앤의 플래그십 팝업스토어. 핑크 오피스 컨셉으로 다양한 색조 제품 체험과 구매 가능.,,['https://blog.naver.com/PostView.naver?blogId=playlikewant&logNo=224255047086']
724,메디힐(Mediheal),메디힐 더마 피부 연구소,,스킨케어,2026-03-18,2026-03-29,,올리브영N성수 1층 트렌드팟,,한국,국내,올리브영N 성수,"더마 패드 존, 마데카소사이드 존, PICK&GO 골라담기 존 운영. 럭키드로우 이벤트와 SNS 팔로우 이벤트.",,['https://blog.naver.com/PostView.naver?blogId=padamnara&logNo=224223827524']
725,피지오겔(PHYSIOGEL),The Red Trace - 붉은기 추적본부,,스킨케어,2026-04-17,2026-04-19,,성수동,,미국/한국(LG생활건강),미국/한국(LG생활건강),,민감 피부 진정과 붉은기 완화 특화 '레드수딩' 라인 팝업. 사건 의뢰인이 되어 붉은기를 수사하는 스토리텔링 방식.,,['http://www.wsobi.com/news/articleView.html?idxno=310711']
726,웨이크메이크(WAKEMAKE),"WAKEMAKE MY COLOR, MY WAY",,메이크업,2026-01-24,2026-02-01,,성수 한서빌딩 (올리브영N 성수 앞),,한국,국내,,40컬러 립스틱 출시 기념. 블러링과 글로우 2가지 텍스처에 40가지 컬러를 담은 립스틱 라인업 체험. 컬러 카드 뽑기 이벤트와 럭키드로우.,,['https://www.threads.com/@sungsooodong/post/DUKLmZ-k5a9/']
727,FEEV,FEEV x Musinsa Pop That Bubble Pop-up,,립케어,2026-05-06,2026-05-17,,"무신사 뷰티 스페이스 1, 성수",,한국,국내,무신사(Musinsa),한국 립케어 브랜드 FEEV의 버블 글로스 6종 체험. 버블 테마의 포토존과 사전예약 이벤트.,,['https://insideseoul.app/seongsu/popups']
