ID,브랜드명,팝업스토어명,카테고리,세부카테고리,시작일,종료일,운영일수,위치,구역,원산지(원본),원산지(정제),콜라보,설명,연도,출처
1322,버버리,버버리 성수 로즈 (Burberry Seongsu Rose),명품/패션,,2023-10-07,2023-11-05,,서울특별시 성동구 연무장길 73,성수1가,영국,영국,,글로벌 프로젝트 '버버리 스트리트' 일환. 크리에이티브 디렉터 다니엘 리의 첫 23F/W 컬렉션을 선보임. 장미 문양으로 화려하게 꾸며진 공간. 연무장길 4개 건축물 대여. 영국 유명 레스토랑 '노만'과 콜라보 카페 운영.,2023,"['https://hanquoclythu.blogspot.com/2024/09/seongsu-dong-thanh-ia-cua-cac-cua-hang.html', 'https://popply.co.kr/magazine/1']"
1323,버버리,버버리 성수 보틀 (Burberry Seongsu Bottle),명품/패션,,2023-10-07,2023-11-05,,서울특별시 성동구 성수동,성수1가,영국,영국,,버버리 스트리트 글로벌 프로젝트의 일환으로 성수동에서 동시에 진행된 3개 팝업 중 하나.,2023,['https://hanquoclythu.blogspot.com/2024/09/seongsu-dong-thanh-ia-cua-cac-cua-hang.html']
1324,버버리,버버리 성수 슈 (Burberry Seongsu Shoe),명품/패션,,2023-10-07,2023-11-05,,서울특별시 성동구 성수동,성수1가,영국,영국,,버버리 스트리트 글로벌 프로젝트의 일환으로 성수동에서 동시에 진행된 3개 팝업 중 하나.,2023,['https://hanquoclythu.blogspot.com/2024/09/seongsu-dong-thanh-ia-cua-cac-cua-hang.html']
1325,탬버린즈,탬버린즈 '토일렛 프래그런스' 팝업스토어,뷰티/향수,,2023-10-01,2023-10-31,,서울특별시 성동구 성수동,성수1가,한국,국내,,"2023년 MZ세대가 선정한 뷰티 팝업 1위. '토일렛 에피소드'를 통해 방핶받고 싶지 않은 공간과 순간에 대한 이야기를 기획. 한 달간 6,000개 이상의 콘텐츠 생성.",2023,['https://popply.co.kr/magazine/1']
1326,이니스프리,이니스프리 'THE NEW ISLE' 이구성수 팝업,뷰티,,2023-04-01,2023-04-23,,서울특별시 성동구 성수동 이구성수(29CM SEONGSU),성수1가,한국,국내,,이니스프리의 새로운 브랜드 아이덴티티를 선보이는 팝업스토어. 자연과 함께하는 새로운 라이프스타일을 제안.,2023,['https://www.apgroup.com/int/ko/news/2023-04-06-1.html']
1327,꼼데가르송,CDGCDGCDG 팝업스토어,패션,,2023-09-22,2023-12-31,,"서울특별시 성동구 연무장길 35, STAGE 35",성수1가,일본,일본,,꼼데가르송의 스트릿 스타일 라인 CDGCDGCDG 팝업. 올오버 로고가 프린트된 박스 형태의 아이코닉한 공간. 한국 익스클루시브 제품 선보임.,2023,['https://m.singleskorea.com/article/717052/THESINGLE']
1328,런던 언더그라운드,런던 언더그라운드 'FIND YOUR UNEXPECTED MOMENT',패션,,2023-09-22,2023-11-19,,서울특별시 성동구 연무장길 20-1,성수1가,영국,영국,,페일 그린 컬러의 지하 터널 콘셉트 팝업. 2023년 8월 론칭한 브랜드의 첫 팝업. 웰컴 기프트 스티커 3종 증정 및 럭키드로우 이벤트.,2023,['https://m.singleskorea.com/article/717052/THESINGLE']
1329,솔티페블,솔티페블 성수 EQL 팝업스토어,패션,,2023-09-24,2023-10-06,,"서울특별시 성동구 연무장15길 11, EQL GROUND",성수1가,한국,국내,,"오아이오아이 정예슬 대표가 론칭한 컨템포러리 브랜드 팝업. 23F/W 신상품 10% 할인, 22F/W 이월 상품 최대 30% 할인.",2023,['https://m.singleskorea.com/article/717052/THESINGLE']
1330,LG디스플레이,LG디스플레이 2022 OLED ART WAVE: NEVER ALONE,전시/기술,,2022-10-01,2022-11-17,,"서울특별시 성동구 연무장5길 20, 성수 쎈느",성수1가,한국,국내,,"예술과 기술의 결합을 보여주는 전시. 류성실, 업체eobchae, 유니버셜에브리띵, 윤향로, 이은솔, 장진승 6팀의 아티스트가 OLED를 창작 도구로 활용한 작품 전시.",2022,['https://www.harpersbazaar.co.kr/article/72241']
1331,파이롯트 오피스,파이롯트 오피스 <소중한 말들 모음 사무소>,라이프스타일/문구,,2022-10-01,2022-11-27,,서울특별시 성동구 연무장길 57,성수1가,일본,일본,,스테이셔너리 브랜드 파이롯트의 팝업. 터키 블루 컬러의 인테리어와 다양한 필기구 구매 가능. 체험 완료 시 2023 미니 달력 선물 증정.,2022,['https://www.harpersbazaar.co.kr/article/72241']
1332,라인프렌즈,라인프렌즈 월드 팝업스토어,캐릭터/라이프스타일,,2022-10-01,2022-11-13,,서울특별시 성동구 성수일로4길 12,성수1가,일본(소프트뱅크),일본(소프트뱅크),,"라인프렌즈 캐릭터들이 모두 모인 팝업. 미니니월드, BT21 베이스캠프, TRUZ 스위트랩 공간. 캐릭터 모티프 빵과 솜사탕, 푸드트럭 존 운영.",2022,['https://www.harpersbazaar.co.kr/article/72241']
1333,무신사,무신사 스토어 성수 뉴 시즌 팝업,패션,,2024-02-26,2024-03-04,,"서울특별시 성동구 성수이로 74, 무신사 스토어 성수",성수1가,한국,국내,,"배드블러드, 더콜디스트모먼트, 알에스에스씨, 아캄, 스키즘 인듀싱 등 5개 브랜드의 신상 컬렉션 팝업. 오프라인에서 가장 먼저 선보이며 추가 할인 혜택 제공.",2024,['https://www.musinsa.com/content/1473960163520542332']
1334,키스,키스 서울(Kith Seoul) 플래그십 스토어,패션/라이프스타일,,2024-05-31,상시운영,,서울특별시 성동구 연무장길 70,성수1가,미국,미국,,"미국 뉴욕 기반 럭셔리 라이프스타일 브랜드 키스의 국내 첫 플래그십. 총 4층 1487㎡(약 450평) 규모. 1층 트리츠 아이스크림 바, 2층 남성/여성/키즈 라인, 3~4층 사델스 레스토랑. 전 세계 매장 중 최대 규모.",2024,"['https://fashionbiz.co.kr/article/209419', 'https://www.wwdkorea.com/news/articleView.html?idxno=6623']"
1335,뉴편한세상 자이,GS건설 자이 브랜드 팝업관,건설/부동산,,2026-05-01,2026-05-15,,서울특별시 성동구 성수일로4길 인근,성수1가,한국,국내,,"GS건설의 성수동 자이 팝업관. 성수1지구 '리베니크 자이'의 가상 한강뷰를 경험할 수 있는 디오라마존, 커뮤니티 시설 소개 어메니티존, 실제 주거 공간 유니트 등으로 조성. 오픈 후 일주일간 4,000여 명 방문.",,['https://www.joongang.co.kr/article/25427269']
1336,뉴편한세상 자이,GS건설 성수동 자이 브랜드 팝업관,건설/부동산,,2024-05-01,2024-05-15,,서울특별시 성동구 성수일로4길 인근,성수1가,한국,국내,,"건설사가 일반 대중을 겨냥해 브랜드 홍보관을 선보인 첫 사례. 2030 잠재 고객과의 접점을 넓히기 위한 시도. 성수1지구 가상 한강뷰 디오라마존과 커뮤니티 시설 어메니티존, 주거 공간 유니트 등으로 구성.",2024,['https://www.joongang.co.kr/article/25427269']
1337,SSG 랜더스,SSG 랜더스 체험형 팝업존,스포츠/굿즈,,2026-03-18,2026-04-16,,서울특별시 성동구 성수동 이마트24 트렌드랩 성수,성수1가,한국,국내,,"프로야구 SSG 랜더스의 체험형 브랜드 팝업존. '인천군 아노락'을 비롯해 마스코트 랜디 키링 등 총 50종의 구단 굿즈 판매. 카카오페이머니, 네이버페이 등 간편결제 30% 할인 혜택.",,['https://www.news1.kr/sports/baseball/6105577']
1338,플러피시트러스(FLCT),A Cloud Traveler (구름 위를 걷는 기분),패션,,2024-04-23,2024-07-28,,서울특별시 성동구 연무장길 81,성수1가,한국,국내,,"구름 위를 걷는 여행자를 컨셉으로 한 플러피시트러스 팝업. 구름 모양 셀카 거울존, SNS 인증 시 솜사탕 증정. 편안하고 가벼움을 강조하는 캐주얼 패션 브랜드.",2024,['https://dategom.com/성수-팝업스토어-5월-이벤트-행사-24년-데이트/']
1339,GS25 X 선양소주,선양카지노 콜라보 팝업,F&B/주류,,2024-04-25,2024-05-12,,"서울특별시 성동구 연무장길 38-1, 도어투성수",성수1가,한국,국내,,"GS25 도어투성수와 선양소주의 콜라보 팝업. 선양카지노 콘셉트로 선양 바, 베팅존(카드 마술, 빅휠, 컵 마술), 선양소주존, 굿즈존, 포토사진관 운영.",2024,['https://dategom.com/성수-팝업스토어-5월-이벤트-행사-24년-데이트/']
1340,메모 파리(MEMO PARIS),메모 그랜드 호텔 팝업스토어,뷰티/향수,,2024-04-09,2024-05-03,,서울특별시 성동구 연무장길 20-1,성수1가,프랑스,프랑스,,"프랑스 니치향수 브랜드 메모 파리와 에스아이빌리지의 콜라보 팝업. 호텔 콘셉트로 스탬프 미션(체크인 카드, 향수 체험, 향수 카운셀링) 진행.",2024,['https://dategom.com/성수-팝업스토어-5월-이벤트-행사-24년-데이트/']
1341,진로,진로골드 판타지아,F&B/주류,,2024-04-05,2024-05-06,,서울특별시 성동구 연무장길 53,성수1가,한국,국내,,"진로의 프리미엄 라인 진로골드 팝업. 5가지 아케이드 게임존(다트, 웨이브 레이스, 바스켓 토스, 링토스, 난타 스탭퍼)에서 미션 성공 시 진로골드 시음 세트 제공.",2024,['https://dategom.com/성수-팝업스토어-5월-이벤트-행사-24년-데이트/']
1342,농심,짜파게티 40주년 분식점 팝업,F&B/라면,,2024-04-12,2024-05-11,,서울특별시 성동구 연무장11길 13,성수1가,한국,국내,,"짜파게티 40주년 기념 팝업. Cook Zone(짜파구리, 마라짜파게티 등), Play Zone(대형 짜파게티 포토존, 스탬프투어), Goods Zone(라면 굿즈)으로 구성.",2024,['https://dategom.com/성수-팝업스토어-5월-이벤트-행사-24년-데이트/']
1343,이니스프리,이니스프리의 인털라이프 팝업,뷰티,,2024-04-10,2024-05-14,,"서울특별시 성동구 성수이로7가길 11, 이니스프리 디아일",성수1가,한국,국내,,"이니스프리 직원 컨셉의 인턴 체험 팝업. 브랜드 헤리티지 둘러보기, 제품 테스트, 핀볼 게임 체험 가능. 인턴십 프로그램 수료 시 할인 혜택.",2024,['https://dategom.com/성수-팝업스토어-5월-이벤트-행사-24년-데이트/']
1344,롬앤,2024 서울 쥬시 올롬픽,뷰티,,2024-04-20,2024-05-02,,"서울특별시 성동구 연무장7길 13, 팩토리얼성수",성수1가,한국,국내,,"롬앤의 서울 올림픽 컨셉 팝업. 스위밍존(볼풀), 볼링존, 포토존, 투표존, 테스터존 운영. 스탬프 미션 성공 시 미니 쥬시 래스팅 틴트 증정.",2024,['https://dategom.com/성수-팝업스토어-5월-이벤트-행사-24년-데이트/']
1345,엄브로,엄브로 100주년 MR.UM's CLEANERS,패션/스포츠,,2024-02-02,2024-06-26,,서울특별시 성동구 연무장길 88,성수1가,영국,영국,,"엄브로 100주년 기념 팝업. 세탁소에서 영감을 받은 감성적인 공간. 옷걸이 커스터마이징 체험 이벤트, 20만원 이상 구매 시 인센스 챔버 선물박스 증정.",2024,['https://dategom.com/성수-팝업스토어-5월-이벤트-행사-24년-데이트/']
1346,마뗑킴,마뗑킴 스페셜 팝업스토어,패션/액세서리,,2024-03-01,2024-05-31,,서울특별시 성동구 연무장길 13,성수1가,한국,국내,,"마뗑킴 시그니처 액세서리 아이템 팝업. 스타일리시한 가방, 모자, 액세서리 판매. 방문 고객 대해 Matin Kim STICKER 증정, 구매 고객 대해 MATIN HEART KEY RING 증정.",2024,['https://dategom.com/성수-팝업스토어-5월-이벤트-행사-24년-데이트/']
1347,아디다스,아디다스 그라운드 성수,패션/스포츠,,2024-10-03,2024-10-06,,서울특별시 성동구 성수동 일대 (7개 공간),성수1가,독일,독일,,"아디다스의 75년 브랜드 히스토리를 담은 대규모 팝업 행사. 앤더슨씨 성수, 무신사스토어 성수@대림창고, 도원 성수, Y173 등 7곳에서 동시 진행. 베이비몬스터, 오상욱 선수 등 참석. 커스텀 존, 스포츠 트레이닝 프로그램, 플라워 클래스 등 운영.",2024,['https://news.nate.com/view/20241009n14547']
1348,뉴편한세상 자이,GS건설 자이 팝업 2호,건설/부동산,,2024-05-01,2024-05-15,,서울특별시 성동구 성수일로4길,성수1가,한국,국내,,GS건설의 두 번째 팝업관. 인천국제공항 프로젝트에 이은 두 번째 팝업으로 성수동에서 운영. 30분 간격 50여명씩 사전예약제 운영.,2024,['https://www.joongang.co.kr/article/25427269']
1349,샤넬,샤넬 조향 마스터클스 성수,명품/뷰티,,2023-12-01,2024-04-30,,서울특별시 성동구 성수동,성수1가,프랑스,프랑스,,북촌 휘겸재에서 이어진 샤넬의 조향 마스터클스. '레 젝스클루시프 드 샤넬'과 N°5 향수 이야기 체험. '샤넬 알쉬믹 향수 여정' 개인 맞춤형 서비스 제공.,2023,['https://www.theden.co.kr/news/articleView.html?idxno=2052']
1350,루이비통,루이비통 '우리 루이비통' 팝업 레스토랑,명품/F&B,,2023-12-01,2024-02-28,,서울특별시 성동구 성수동,성수1가,프랑스,프랑스,,"루이비통의 한국 네 번째 팝업 레스토랑. 조희숙, 조은희, 박성배, 강민구, 이은지 등 국내 최정상 셰프와 협업. 쪽빛으로 꾸며진 공간에서 한국 고유의 맛을 재해석한 메뉴 제공.",2023,['https://www.theden.co.kr/news/articleView.html?idxno=2052']
1351,디올,디올 성수 연말 리뉴얼,명품/패션,,2023-12-01,2024-01-31,,"서울특별시 성동구 연무장5길, 디올 성수",성수1가,프랑스,프랑스,,디올 성수 콘셉트 스토어 연말 리뉴얼. 날개를 펼친 우아한 나비 조형물과 금빛 생명의 나무 설치. 2024 크루즈 컬렉션(멕시코 문화) 전시.,2023,['https://www.theden.co.kr/news/articleView.html?idxno=2052']
1352,3CE,3CE 벨벳 케이크 샵 팝업스토어,뷰티,,2025-10-22,2025-11-03,,"서울특별시 성동구 성수동, 트렌트팟 바이 올리브영 성수",성수1가,한국,국내,,"3CE 신제품 버터 벨벳 틴트와 벨벳 립 틴트 플러쉬 출시 기념 팝업. 케이크 샵 콘셉트, '아우푸글렛'과 협업한 팝시클 모양 디저트 선착순 400명 증정.",2025,['https://www.mhnse.com/news/articleView.html?idxno=476779']
1353,토리든,토리든 '솔리빌리지' 팝업스토어,뷰티/스킨케어,,2025-10-22,2025-12-31,,"서울특별시 성동구 성수동, 토리든 커넥트 성수",성수1가,한국,국내,,"건조한 계절을 맞아 '진짜 보습 장벽'을 테마로 한 이색 팝업. 촉촉한 보습 이글루 마을 콘셉트. 이글루 포토존, AR 스노우볼 셀피존, 보습 눈꽃 뜨개 키링 클래스 운영.",2025,['https://www.mhnse.com/news/articleView.html?idxno=476779']
1354,플라워노즈,플라워노즈 '스위티 베어' 팝업스토어,뷰티,,2025-11-18,2026-01-01,,서울특별시 성동구 성수역 3번 출구 앞,성수1가,한국,국내,,"달콤한 디저트 향으로 가득한 동화 같은 공간. 나만의 스위티 키링 만들기 DIY, 스위티 베어 포토부스, 럭키드로우 이벤트(선착순 7,000명) 진행.",2025,['https://www.mhnse.com/news/articleView.html?idxno=476779']
1355,세븐틴,홀리데이 with 미니틴 팝업스토어,엔터테인먼트/굿즈,,2025-12-01,2025-12-22,,서울특별시 성동구 성수동,성수1가,한국,국내,,"세븐틴 공식 캐릭터 '미니틴'의 홀리데이 시즌 테마 팝업. 미니틴 빌리지 콘셉트, 대형 크리스마스 트리. 굿즈존, 전시존, 카페존, 포토부스 4개 존으로 구성.",2025,['https://stibee.com/api/v1.0/emails/share/eskmQHPxIlC7ivYMAlFsqZU5keM0dno']
1356,젠틀몬스터,젠틀몬스터 X 브랏츠 팝업,패션/아이웨어,,2025-05-30,2025-10-30,,서울특별시 성동구 성수이로7길 26,성수1가,한국,국내,,"젠틀몬스터와 브랏츠(Bratz)의 콜라보 팝업. 폴팅 아이웨어 컬렉션, 인형 키링 DIY, AI 캐릭터 체험존, 포토부스 운영. 미래적 감성과 Y2K 감성의 조화.",2025,"['https://popga.co.kr/popup/2865', 'https://blog.naver.com/davi-kim/224053741743']"
1357,정샘물,정샘물 '쿠션 아트 스쿨' 팝업스토어,뷰티/메이크업,,2025-05-09,2025-05-22,,"서울특별시 성동구 성수동, 무신사 스토어 성수@대림창고",성수1가,한국,국내,,"정샘물 뷰티의 '쿠션 아트 스쿨' 콘셉트 팝업. 플레이 그라운드, 과학시간(SCIENCE CLASS ZONE), 아트 클래스 등 체험존 운영. 에센셜 스킨 누더 쿠션 글로벌 버전 30종 체험 가능.",2025,['https://cosmorning.com/news/article.html?no=50442']
1358,까륝티에,까륝티에 시계 단독 전시,명품/시계,,2023-06-01,2023-06-18,,서울특별시 성동구 성수동,성수1가,프랑스,프랑스,,국내 최초로 까륝티에 시계의 단독 전시가 열린 팝업 스토어. 다양한 까륝티에 시계 컬렉션을 감상할 수 있는 전시.,2023,['https://stories.amorepacific.com/팝업의-성지-성수동-변천사/']
1359,자크뮈스,자크뮈스 성수동 팝업스토어 'Le Cafe Fleur',명품/패션,,2023-10-01,2023-10-31,,서울특별시 성동구 성수동,성수1가,프랑스,프랑스,,프랑스 디자이너 브랜드 자크뮈스의 성수동 팝업. 'Le Cafe Fleur' 콘셉트로 운영되며 화제를 모음.,2023,['https://v.daum.net/v/7i29OlVsFz?f=p']
1360,무신사,무신사 메가스토어 성수 그랜드 오픈,패션/뷰티,,2026-04-24,상시운영,,서울특별시 성동구 성수이로 74,성수1가,한국,국내,,"단일 매장 기준 국내 최대 규모의 패션·뷰티 스토어. 약 2,000평 규모, 1,000여 개 브랜드 입점. 지하 1층~4층까지 패션, 뷰티, 푸드가든 등 복합 공간.",,['https://newsroom.musinsa.com/newsroom-menu/2026-0423-01']
1361,프랜틱서비스,프랜틱서비스 팝업 'Service Stay',패션,,2026-04-24,2026-05-10,,"서울특별시 성동구 성수이로 74, 무신사 메가스토어 성수 1F",성수1가,한국,국내,,"무신사 메가스토어 성수 오픈 기념 팝업. 무신사 메가스토어 성수에서만 선보이는 한정 상품, 구매 금액별 기프트, 최대 50% 할인 혜택 제공.",,['https://www.musinsa.com/content/1491300179556090683']
1362,뉴에라,뉴에라 팝업 'NFL Blokecore with Kyoka',패션/액세서리,,2026-04-24,2026-05-10,,"서울특별시 성동구 성수이로 74, 무신사 메가스토어 성수 1F",성수1가,미국,미국,,세계적인 댄서 쿄카(Kyoka)와 협업한 'New Era Blokecore' 라인업. 다양한 커스텀 아이템으로 단 하나뿐인 스타일 완성 가능.,,['https://www.musinsa.com/content/1491300179556090683']
1363,로에베 퍼퓸,로에베 퍼퓸 성수 플래그십 스토어,뷰티/향수,,2026-01-15,상시운영,,서울특별시 성동구 연무장길 7,성수1가,스페인,스페인,,"로에베 퍼퓸 브랜드 역사상 전 세계 첫 단독 플래그십 스토어. 104평 2층 공간. 한옥에서 영감받은 중앙 정원(파티오), 2층 카페 운영. 크래프티드 컬렉션, 보태니컬 레인보우 등 전 제품군 전시.",,['https://design.co.kr/article/145473/']
1364,뉴편한세상 자이,GS건설 자이 브랜드 팝업관 3호,건설/부동산,,2026-05-01,2026-05-15,,서울특별시 성동구 성수일로4길 인근,성수1가,한국,국내,,"GS건설의 세 번째 팝업관. 인천국제공항, 현대백화점에 이은 3번째 팝업. 2030 잠재 고객 대상 주거 브랜드 체험 공간.",,['https://www.joongang.co.kr/article/25427269']
1365,사르투,사르투 2026 첫 팝업,패션/액세서리,,2026-04-21,2026-04-28,,서울특별시 성동구 성수동 연무장길 일대,성수1가,한국,국내,,"사르투 2026년 첫 팝업. 레몬빛 무드의 봄 컨셉 공간. 리미티드 컬러 'Butter Lemon TYE Tote' 최초 공개. 베스트셀러부터 신상, 팝업 한정 아이템까지 한 번에 볼 수 있음.",,['https://blog.naver.com/davi-kim/224264244082']
1366,토리든,토리든x코르티스 팝업 '토리든커넥트성수',뷰티,,2026-04-01,2026-05-31,,서울특별시 성동구 성수동 토리든커넥트성수,성수1가,한국,국내,,"토리든과 코르티스의 콜라보 팝업. 브랜드 메시지를 공간으로 풀어낸 층별 구성. 게임, 마스크팩 체험, 일본 고객 대응 등 글로벌 팝업 운영.",,['https://blog.naver.com/davi-kim/224264244082']
1367,악마는 프라다를 입는다,악마는 프라다를 입는다2 팝업,엔터테인먼트,,2026-04-01,2026-04-27,,"서울특별시 성동구 성수동, 올리브영N성수",성수1가,미국,미국,,"영화 '악마는 프라다를 입는다2' 개봉 기념 팝업. 데빌 레드힐 오브제, '런웨이' 매거진 편집실 재현. 포토존 조명과 구도가 잘 잡혀 잡지 커버 느낌 사진 촬영 가능. SNS 인증 또는 퀴즈 참여 시 럭키드로우.",,['https://blog.naver.com/davi-kim/224264244082']
1368,아이소이,아이소이 '흔적 케어 프로젝트' 팝업스토어,뷰티,,2026-04-01,2026-05-31,,서울특별시 성동구 성수동,성수1가,한국,국내,,"아이소이 신제품 브라이트닝 칼밍 스팟 세럼 출시 기념 팝업. 모델 계훈을 중심으로 한 캠페인 콘셉트. 인스타그램/카카오톡 채널 추가, 낱말 퀴즈, 게임 등 3가지 미션 완료 시 스탬프 수여 및 럭키드로우 참여 가능.",,['https://blog.naver.com/davi-kim/224264244082']
1369,키엘,키엘 '피부 장벽 응급 구조대' 팝업,뷰티/스킨케어,,2026-04-01,2026-05-15,,서울특별시 성동구 성수동,성수1가,미국,미국,,"키엘 팝업스토어. '피부 장벽 응급 구조대' 콘셉트로 판테놀 함유 메디크림 신제품 체험. 더마리더 1:1 피부 진단 서비스(예약자 한정). 방문 시 SOS 키트 증정, SNS 팔로우 시 메디크림 대용량 샘플 추가 증정.",,['https://blog.naver.com/davi-kim/224264244082']
1370,삐아,삐아 틴트 물리 증정 팝업,뷰티,,2025-01-01,2025-01-31,,서울특별시 성동구 성수동 일대,성수1가,한국,국내,,성수동 곳곳에 틴트 물리 증정 쿠폰이 붙은 전단지를 부착하여 화제를 모은 팝업. 전단지를 들고 매장에 방문하면 틴트 본품을 바로 받을 수 있는 이벤트 진행.,2025,['https://stibee.com/api/v1.0/emails/share/eskmQHPxIlC7ivYMAlFsqZU5keM0dno']
1371,아디다스,아디다스 팝업스토어 (SPACE-S1),패션/스포츠,,2025-04-09,2025-04-23,,"서울특별시 성동구 성수동, SPACE-S1",성수1가,독일,독일,,"SPACE-S1에서 진행된 아디다스 팝업스토어. 일 평균 900여 명 방문, 누적 방문객 약 2만 명 기록. 성수 상권 내 대형 팝업 공간에서 진행.",2025,['https://tnnews.co.kr/archives/189580']
1372,칠,칠 팝업스토어 (SPACE-S1),F&B/커피,,2024-12-08,2025-01-28,,"서울특별시 성동구 성수동, SPACE-S1",성수1가,한국,국내,,"칠 브랜드 팝업스토어. 일 평균 1,000여 명 방문, 팝업 기간 동안 누적 방문객 3만 명 기록. 성수 상권 내 대형 팝업 공간 활용.",2024,['https://tnnews.co.kr/archives/189580']
1373,무한도전,무한도전 20주년 팝업스토어,엔터테인먼트/굿즈,,2025-12-01,2025-12-16,,서울특별시 성동구 성수동,성수1가,한국,국내,,MBC 예능 프로그램 '무한도전' 20주년 기념 팝업스토어. 다양한 굿즈와 전시 콘텐츠로 구성.,2025,['https://stibee.com/api/v1.0/emails/share/eskmQHPxIlC7ivYMAlFsqZU5keM0dno']
1374,디즈니플러스,디즈니플러스 '삼식이 삼촌' 팝업,엔터테인먼트,,2024-05-01,2024-05-31,,서울특별시 성동구 연무장길,성수1가,미국,미국,,디즈니플러스 오리지널 시리즈 '삼식이 삼촌' 공개 기념 팝업. 빵집과 사무실 등 작품 속 배경을 그대로 구현하여 몰입감을 제공.,2024,['https://hanquoclythu.blogspot.com/2024/09/seongsu-dong-thanh-ia-cua-cac-cua-hang.html']
1375,일룸,일룸 '더 모션 클럽',라이프스타일/가구,,2025-05-01,2025-05-31,,"서울특별시 성동구 성수동, 성수율",성수1가,한국,국내,,"일룸의 몰입형 사운드 공간. '멍잠'을 주제로 모션베드 위에서 독서, 요가, 뜨개질, 영화 및 라이브 공연 감상 등 다채로운 체험 프로그램 운영.",2025,['https://v.daum.net/v/6iHs8unQUx?f=p']
1376,프라다 뷰티,프라다 뷰티 성수 플래그십,명품/뷰티,,2025-01-01,상시운영,,서울특별시 성동구 성수동 연무장길,성수1가,이탈리아,이탈리아,,프라다 뷰티의 성수동 플래그십 스토어. 성수동 동연무장길에 위치하여 MZ세대와의 접점을 확대.,2025,['https://www.joongang.co.kr/article/25315804']
1377,뉴편한세상 자이,GS건설 자이 브랜드 팝업관 (2026년 2차),건설/부동산,,2026-05-01,2026-05-15,,서울특별시 성동구 성수일로4길 인근,성수1가,한국,국내,,GS건설의 2026년 성수동 자이 브랜드 팝업. 2035년 준공 예정인 성수1지구 '리베니크 자이'의 가상 한강뷰와 주거 공간을 체험할 수 있는 공간. 30분 간격 50여명 사전예약제.,,['https://www.joongang.co.kr/article/25427269']
1378,브랜디멜빌,브랜디멜빌 성수 매장,패션,,2024-05-01,상시운영,,서울특별시 성동구 동연무장길,성수1가,이탈리아,이탈리아,,해외 Z세대의 취향을 저격한 패션 브랜드 브랜디멜빌의 첫 국내 매장. 동연무장길에 위치.,2024,['https://www.joongang.co.kr/article/25315804']
1379,밀로 아카이브,밀로 아카이브 성수 매장,패션,,2025-02-01,상시운영,,서울특별시 성동구 동연무장길,성수1가,한국,국내,,2030에 인기 있는 국내 디자이너 브랜드 밀로 아카이브의 동연무장길 매장.,2025,['https://www.joongang.co.kr/article/25315804']
