ID,브랜드명,팝업스토어명,카테고리,세부카테고리,시작일,종료일,운영일수,위치,구역,원산지(원본),원산지(정제),콜라보,설명,연도,출처
1982,롯데칠성음료,밀키스 구름 하우스 팝업,F&B,,2023-04-01,2023-05-15,,서울특별시 성동구 성수동,성수 주요상권,대한민국,국내,,밀키스 팝업스토어. 하루 700명 이상 방문. 성수동 대표 체험형 팝업.,2023,['https://magazine.hankyung.com/business/article/202305106721b']
1983,어메이징오트,어메이징 오트 팝업,F&B,,2022-06-01,2022-07-15,,서울특별시 성동구 성수동,성수 주요상권,대한민국,국내,,매일유업의 어메이징 오트 팝업. 프로젝트렌트 기획. 소비자 반응 뜨거웠던 대표 팝업.,2022,['https://economychosun.com/site/data/html_dir/2023/07/22/2023072200007.html']
1984,오끼뜨,오끼뜨 팝업 스토어,라이프스타일/홈패브릭,,2025-10-01,2025-10-31,,"서울특별시 성동구 성수이로18길 43 (무신사 스페이스 성수 3, 이구홈 성수)",성수 주요상권,대한민국,국내,,"홈 패브릭 브랜드 오끼뜨 팝업. 파자마, 베개 커버, 쿠션 등 아늑한 라이프스타일 아이템.",2025,['https://novicehood.tistory.com/entry/2025년-10월-넷째-주-성수동-팝업-스토어-일정-정리']
1985,CAT POP-UP,CAT POP-UP STORE,캐릭터/굿즈,,2025-10-23,2025-11-01,,"서울특별시 성동구 연무장길 13, 1층 태그 샵",성수 주요상권,대한민국,국내,,"고양이 테마 팝업스토어. 고양이 키링, 스티커, 노트 등 귀여운 굿즈. 꽝 없는 물비 이벤트.",2025,['https://novicehood.tistory.com/entry/2025년-10월-넷째-주-성수동-팝업-스토어-일정-정리']
1986,ALT+G,ALT+G 인디게임 페스티벌,게임/문화,,2025-10-25,2025-10-25,,서울특별시 성동구 연무장로 일대,성수 주요상권,대한민국,국내,,인디게임 페스티벌. 다양한 인디게임 직접 시연. 물비 입장.,2025,['https://novicehood.tistory.com/entry/2025년-10월-넷째-주-성수동-팝업-스토어-일정-정리']
1987,제로이드,제로이드 퀴즈 묹 팝업,뷰티,,2025-10-25,2025-10-26,,서울특별시 성동구 연무장길 일대,성수 주요상권,대한민국,국내,,"뷰티 브랜드 제로이드 이동식 퀴즈 팝업. 퀴즈 풀며 뷰티 제품 체험, 샘플 수령.",2025,['https://novicehood.tistory.com/entry/2025년-10월-넷째-주-성수동-팝업-스토어-일정-정리']
1988,집집,집집 소중한 잡동사니 마켓,핸드메이드/굿즈,,2025-10-24,2025-10-26,,서울특별시 성동구 성수일로 33 (하얀 건축),성수 주요상권,대한민국,국내,,"핸드메이드 굿즈 마켓. 수작업 원화 키링, 액자 등 아티스트 개성 넘치는 굿즈. 3층 도너리 부스.",2025,['https://novicehood.tistory.com/entry/2025년-10월-넷째-주-성수동-팝업-스토어-일정-정리']
1989,바이오던스,바이오던스 글로우 스테이 인 성수,뷰티,,2025-10-01,2025-10-31,,서울특별시 성동구 성수동 (바이오던스 성수 스토어),성수 주요상권,대한민국,국내,,"배우 공명 팬 참여 바이오던스 팝업. 공명 비하인드 이벤트, 아름다움 충전 테마, 사진 명소.",2025,['https://novicehood.tistory.com/entry/2025년-10월-넷째-주-성수동-팝업-스토어-일정-정리']
1990,압구정막걸리,압구정 막걸리 팝업,F&B/주류,,2025-10-01,2025-10-31,,서울특별시 성동구 성수동2가 272-32 1층,성수 주요상권,대한민국,국내,,전통 막걸리를 테마로 한 체험과 시음 팝업. 전통과 현대가 만나는 색다른 팝업.,2025,['https://novicehood.tistory.com/entry/2025년-10월-넷째-주-성수동-팝업-스토어-일정-정리']
1991,바라던바다,바라던바다 팝업,라이프스타일,,2025-07-11,2025-07-31,,서울특별시 성동구 성수이로 141-2,성수 주요상권,대한민국,국내,,와디즈 X 성수 콜라보 팝업.,2025,['https://blog.naver.com/qotkah223/223940078673']
1992,아이소이,아이소이 장수진 포차 팝업,뷰티,,2024-06-01,2024-07-15,,서울특별시 성동구 성수동,성수 주요상권,대한민국,국내,,아이소이 뷰티 팝업. 장수진 포차 콘셉트.,2024,['https://letter.wepick.kr/post/2077']
1993,헤이딜러X아모레퍼시픽,헤이딜러 X 아모레퍼시픽 내차조향소 팝업,뷰티/자동차,,2024-05-01,2024-06-15,,서울특별시 성동구 성수동,성수 주요상권,대한민국,국내,,헤이딜러와 아모레퍼시픽 콜라보 내차조향소 팝업.,2024,['https://letter.wepick.kr/post/2077']
1994,아이오페,아이오페 'FIND MY RETINOL' 팝업,뷰티,,2024-07-01,2024-08-15,,서울특별시 성동구 성수동,성수 주요상권,대한민국,국내,,아이오페 레티놀 제품 팝업. FIND MY RETINOL 캠페인.,2024,['https://letter.wepick.kr/post/2077']
1995,롱샴,롱샴 'ENERGY BY LONGCHAMP' 팝업,패션/잡화,,2024-08-01,2024-09-15,,서울특별시 성동구 성수동,성수 주요상권,프랑스,프랑스,,롱샴 에너지 콜라보 팝업. 에너제틱한 콘셉트.,2024,['https://letter.wepick.kr/post/2077']
1996,TEKLA,TEKLA 이구성수 팝업,라이프스타일/홈,,2024-09-01,2024-10-15,,서울특별시 성동구 성수동 (이구홈 성수),성수 주요상권,덴마크,덴마크,,TEKLA 홈텍스타일 팝업. 이구홈 성수에서 운영.,2024,['https://letter.wepick.kr/post/2077']
1997,모리스앤보리스,모리스 & 보리스 행욘던전 팝업 스토어,캐릭터/굿즈,,2024-05-01,2024-06-15,,서울특별시 성동구 성수동,성수 주요상권,대한민국,국내,,모리스 & 보리스 캐릭터 행욘던전 콘셉트 팝업.,2024,['https://letter.wepick.kr/post/2077']
1998,브런치스토리,브런치스토리 '작가의 여정' 팝업,콘텐츠/IT,,2024-08-01,2024-09-30,,서울특별시 성동구 성수동,성수 주요상권,대한민국,국내,,카카오 브런치스토리 작가 여정 전시 팝업.,2024,['https://letter.wepick.kr/post/2077']
1999,가비지타임,가비지타임 팝업 'SCHOOL OF GARBAGE TIME',엔터/웹툰,,2024-09-01,2024-10-31,,서울특별시 성동구 성수동,성수 주요상권,대한민국,국내,,웹툰 가비지타임 학교 콘셉트 팝업. SCHOOL OF GARBAGE TIME 테마.,2024,['https://letter.wepick.kr/post/2077']
2000,타이레놀,타이레놀 팝업 'T Magazine',헬스/웰니스,,2024-08-01,2024-09-15,,서울특별시 성동구 성수동,성수 주요상권,미국,미국,,타이레놀 T Magazine 콘셉트 팝업. 건강 및 웰니스 체험.,2024,['https://letter.wepick.kr/post/2077']
2001,JAAH,JAAH 런칭 팝업,패션,,2025-09-01,2025-09-15,,서울특별시 성동구 성수동,성수 주요상권,대한민국,국내,,패션 브랜드 JAAH 런칭 팝업스토어.,2025,['https://blog.naver.com/farbemaria/223992556263']
2002,논픽션,논픽션 성수 홀리데이 팝업,뷰티/향수,,2024-12-01,2025-01-15,,서울특별시 성동구 성수동 (논픽션 성수 2층),성수 주요상권,대한민국,국내,,논픽션 성수 매장 홀리데이 시즌 팝업. 전시 및 체험형 공간. 가수 겸 배우 윤계상 배우자 차혜영 대표가 2019년 론칭한 브랜드.,2024,['http://m.yakup.com/news/index.html?mode=view&cat=12&nid=304890']
2003,오딧세이,오딧세이 성수 팝업 (입점 준비),뷰티/향수,,2025-01-01,2025-03-31,,서울특별시 성동구 연무장길 (성수 퍼퓸로드),성수 주요상권,대한민국,국내,,남성 향수 브랜드 오딧세이 성수 입점 준비 팝업. 성수 퍼퓸로드 일원.,2025,['http://m.yakup.com/news/index.html?mode=view&cat=12&nid=304890']
2004,성수에디터,성수에디터 올리브영N성수 팝업,뷰티,,2025-01-01,2025-02-15,,서울특별시 성동구 연무장7길 13 (올리브영N성수 1층 트렌드팟),성수 주요상권,대한민국,국내,,뷰티 브랜드 성수에디터 올리브영N성수 1층 트렌드팟 팝업. 많은 인파 모여 성수 뷰티 팝업 열풍.,2025,['https://somako.co.kr/다시-가본-성수동-이제-뷰티-플래그십-스토어-성지로-불러야']
2005,삐아,삐아 쀼:니버시티 팝업,뷰티,,2024-08-01,2024-09-15,,서울특별시 성동구 성수동,성수 주요상권,대한민국,국내,,"삐아 창립 20주년 기념 팝업. '삐아대' 학생이 되어 입학부터 졸업까지 체험. 계열 브랜드 선보임, 브랜드별 구매 이벤트.",2024,['https://www.sweetspot.co.kr/contents_blog/?bmode=view&idx=164666855']
2006,몽벨,몽벨 이태원 팝업,패션/아웃도어,,2025-10-01,2025-10-15,,서울특별시 용산구 이태원동,이태원 연계상권,미국,미국,,"몽벨 이태원 팝업. 오픈 10일간 누적 매출 8,000만 원, 방문객 4,000명 기록. 성수-이태원 연계 패션 팝업.",2025,['http://m.apparelnews.co.kr/news/news_view/?idx=222228']
2007,아더에러,아더에러 시그니피컨트 성수 플래그십,패션/플래그십,,2025-02-01,2099-12-31,,서울특별시 성동구 성수동,성수 주요상권,대한민국,국내,,"아더에러 성수에만 매장 4개. 점, 선, 면 요소로 시그니피컨트 정체성을 공간 디자인으로 표현.",2025,['https://fashionbiz.co.kr/article/213860']
2008,디올,디올 성수 (Dior Seongsu),럭셔리 패션/뷰티,,2022-05,상설 전환,,성수동 연무장길 일대,,프랑스,프랑스,,디올이 성수동에 국내 두 번째 단독 매장을 오픈. 파리 몽테뉴 거리의 디올 플래그십 스토어를 재현한 외관이 특징. 6개월 한정 운영 예정이었으나 인기로 상설 플래그십 스토어로 전환됨. 성수동 팝업 상권의 대표적인 성공 사례.,2022,"https://www.joongang.co.kr/article/25200944, https://biz.newdaily.co.kr/site/data/html/2023/08/28/2023082800065.html"
2009,버버리,버버리 스트리트 (Burberry Streets),럭셔리 패션,,2023-10-07,2023-11-05,,"성수동 연무장길 (성수 로즈, 성수 보틀, 성수 슈 3개소)",,영국,영국,,"크리에이티브 디렉터 다니엘 리의 첫 번째 컬렉션 공개를 기념한 글로벌 프로젝트 '버버리 스트리트'의 일환. 성수 로즈(컬렉션 전반), 성수 슈(신발 전문), 성수 보틀(핫 워터보틀) 3개 팝업 매장을 연무장길에 동시 오픈. Norman's와 협업한 카페도 운영. 본래 목표 6개월이었으나 인기로 상설 플래그십 매장으로 전환됨. 연무장길 전체를 병빛 천으로 장식해 '버버리 스트리트'를 조성.",2023,"https://www.news1.kr/industry/distribution/5204519, https://www.joongang.co.kr/article/25200944"
2010,자크뮈스,르 카페 플뢰르 부티크 (Le Cafe Fleur),럭셔리 패션/엔터,,2023-10-20,2023-10-29,,성수동 카페 오우드 성수 1호점 (연무장길 101-1),,프랑스,프랑스,,"아시아 최초로 오픈한 자크뮈스 팝업스토어. 시그니처 가방 '밤비무(Bambimou)'를 초대형 사이즈로 형상화한 파사드가 특징. 카페 코너(음료 8종), 플라워 코너(리시안셔스 부케), FW 컬렉션 액세서리 판매 3가지 공간으로 구성. 시몽 포르테 디자이너가 인스타그램으로 한국어로 예고.",2023,"http://www.fi.co.kr/main/view.asp?idx=80501, https://nw1423.com/article/magazine/8/371/"
2011,이니스프리,이니스프리 디아일 성수 (THE ISLE SEONGSU),뷰티/화장품,,2023-10-24,상설,,성수동 성수이로7가길 11,,한국,국내,,"이니스프리의 플래그십 스토어. '도심에서 마주한 섬'을 콘셉트로 한 이색적인 공간. 스토어와 카페, 펫 프렌들리 존으로 구성. 오픈 시 '그린티 유니버스 팝업 스토어'를 동시 운영하며 뷰티 크리에이터 '레오제이'가 메인 디렉터로 참여. DIY 캔들, 섬 모티브 디저트 등 플래그십 전용 제품 제공.",2023,https://www.apgroup.com/int/ko/news/2023-10-24-1.html
2012,케이스위스(K-SWISS),K-SWISS 성수 플래그십 스토어,스포츠/패션,,2026-05-01,상설,,성수동 연무장길 93,,미국,미국,,"브랜드 60주년을 기념한 국내 첫 플래그십 스토어. 테니스 코트에서 영감받은 외관 디자인. 1층은 신발/의류와 F&B 카페, 2층은 '클럽하우스 로비' 콘셉트의 럭셔리 공간. 한국에서만 판매하는 'Seoul-에디션'과 다양한 브랜드/아티스트 컬래버레이션 아이템 선보임. 테니스 DNA를 현대적으로 재해석한 복합 문화 공간.",,"https://www.newswire.co.kr/newsRead.php?no=1033697, http://www.ktnews.com/news/articleView.html?idxno=145950"
2013,GMC,GMC 그랜드 런치 팝업스토어,자동차,,2026-01-29,2026-02-01,,성수동 성수이로 72,,미국,미국,,"GMC의 신차 3종(허머 EV, 아칼리아 드날리 얼티밋, 캐니언 드날리) 국내 출시 기념 팝업. 차량 전시와 시승 체험, '드날리 피크 챌린지' 게임, 포토부스, 소셜 공유 이벤트 등 다양한 고객 참여 프로그램 운영. 11시~19시 운영.",,https://news.gm-korea.co.kr/ko/home/newsroom.detail.html/Pages/news/kr/ko/2026/jan/0130_GMC_POP-UP-STORE.html
2014,해이원(Heyone),해이원 성수 플래그십 스토어,캐릭터/완구,,2026-04,상설,,성수동,,중국,중국,,중국 아트토이 브랜드 해이원의 국내 첫 오프라인 매장. 260㎡(약 78평) 규모. 오즈아이라는 캐릭터 IP를 중심으로 한 다양한 캐릭터 상품 전시. 중국 본토에서도 열지 않은 대형 플래그십 스토어를 한국에 처음 선보임.,,https://www.hankyung.com/article/2026050454081
2015,롬앤(rom&nd),서울 쥬시 올롬픽 (Seoul Juicy Olumpic),뷰티/화장품,,2024,2024,,성수동,,한국,국내,,"롬앤의 대표 제품 쥬시 래스팅 틴트를 메인으로 한 팝업스토어. 올림픽 콘셉트를 활용한 체험형 이벤트. 스위밍, 볼링 등 다채로운 스포츠 게임, 관중석 콘셉트 포토존, 단종 제품 재출시 패자부활전 등 운영.",2024,https://www.sweetspot.co.kr/contents_blog/?bmode=view&idx=164666855
2016,3CE,3CE 벨벳 케이크샵 팝업,뷰티/화장품,,2024-10-22,2024-11-03,,올리브영N 성수 (연무장7길 13),,한국,국내,,3CE의 벨벳 케이크샵 콘셉트 팝업스토어. 올리브영N 성수점에서 진행. 2024년 성수동에서 활발하게 진행된 뷰티 팝업 대표 사례.,2024,https://www.seongsudonggorilla.com/article/376
2017,마리떼(Marithe),샬레 드 마리떼 (Chalet de Marithe),패션/의류,,2024-12,2024-12-31,,성수동 마리떼 성수,,프랑스,프랑스,,마리떼의 연말 시즌 팝업스토어. 브랜드 정체성을 극대화한 공간 구성으로 소비자 호응을 얻음. 성수동에서 2024년 말까지 운영된 대표 패션 팝업.,2024,"https://www.bloter.net/news/articleView.html?idxno=628550, https://www.seongsudonggorilla.com/article/376"
2018,베이비몬스터,베이비몬스터 팝업스토어,엔터테인먼트/K-pop,,2024,2024,,성수동,,한국,국내,,YG 신인 아이돌 그룹 베이비몬스터의 첫 정규 앨범 발매 기념 팝업스토어. 틱톡 신곡 챌린지 촬영 공간을 낭부에 마련해 신곡 홍보 효과 극대화. 뮤직비디오 속 댄서 모습으로 분장한 프로모터들이 성수동 인근을 돌며 홍보 활동 및 상품 쿠폰 증정.,2024,https://www.sweetspot.co.kr/contents_blog/?bmode=view&idx=164666855
2019,차린건 쥐뿔도 없지만(차쥐뿔),차쥐뿔 팝업스토어,엔터테인먼트/크리에이터,,2024-11-16,2024-11-24,,"성수동 성수일로 47, 1층 마플샵",,한국,국내,,"유튜버 이영지의 인기 채널 '차린건 쥐뿔도 없지만'을 주제로 한 최초 오프라인 팝업. 입구에 거대한 이영지 입간판을 배치, 유튜브 촬영 공간을 그대로 재현한 포토존과 굿즈존으로 구성. 굿즈 판매 수익금 전액 기부. 사전예약 11월 8일 오픈.",2024,"https://dayforyou.com/getDetail?scheduleSeq=889, https://popga.co.kr/popup/993"
2020,진로,진로골드 팝업스토어,주류/F&B,,2024,2024,,성수동,,한국,국내,,"진로의 독창적인 체험형 팝업스토어. 금빛 회전목마로 시작해 링토스, 난타 스텝퍼, 다트 등 5가지 게임과 진로 시음을 제공. 럭키 드로우, 굿즈존 등 다양한 즐길 거리 마련.",2024,https://www.sweetspot.co.kr/contents_blog/?bmode=view&idx=164666855
2021,용가리치킨(하림),용가리가 사라졌다 팝업스토어,식품/F&B,,2024-10-07,2024-11-03,,성수동 2가 271-6 (성수역 3번 출구 도보 6분),,한국,국내,,"용가리치킨 25주년 기념 팝업스토어. 실내 '용가리 PUB'(게임존, 굿즈존, 취식존)과 야외 '도기존'(반려견 게임존, 펫푸드존)으로 구성. 990원에 안주+맥주 제공. 반려견 동반 가능. 2030세대를 겨냥한 추억의 게임, 음악, 먹거리와 반려견을 위한 이벤트를 동시 제공. 용가리 불볶음면, 불용가리치킨 등 신메뉴 홍보.",2024,"https://letter.wepick.kr/post/2077, https://news.nate.com/view/20241013n15107"
2022,루이비통,루이비통 LVMenFW21 팝업스토어,럭셔리 패션,,2021-07,2021-08,,성수동 대형 카페,,프랑스,프랑스,,루이비통의 2층 규모 대형 팝업스토어. BTS가 모델로 등장한 LVMenFW21 컬렉션 공개를 기념. 컬렉션의 메인인 그린 컬러로 건축물 전체를 덮고 그린 컬러 컬렉션과 포토월 로고를 설치. 로고 포토존과 업사이클 제품 전시를 통한 바이럴 효과. 성수동에서 진행된 초기 명품 팝업 대표 사례.,2021,"https://www.exclosetshop.com/trendnews/?bmode=view&idx=11301505, https://oncuration.com/%ED%95%9C%EA%B5%AD%EC%9D%98-%EB%B8%8C%EB%A3%A8%ED%81%B4%EB%A6%B0%EC%9C%BC%EB%A1%9C-%EB%96%A0%EC%98%A4%EB%A5%B8-%EC%84%B1%EC%88%98%EB%8F%99/"
2023,샤넬,샤넬 팩토리 5 (Chanel Factory 5),럭셔리 뷰티/향수,,2021-06,2021-07,,성수동,,프랑스,프랑스,,"샤넬 넘버 5 향수 100주년을 기념하는 팝업스토어. 넘버 5의 아이덴티티를 부여한 정비소, 주방, 화실 등의 콘셉트로 공간을 꾸밈. 오프닝 행사에 박서준, 이성경, 샤이니 민호, 레드벨벳 예리 등 유명 셀럽 참여.",2021,https://www.exclosetshop.com/trendnews/?bmode=view&idx=11301505
2024,에륭스,에륭스 헤리티지 전시,럭셔리 패션/전시,,2021-05,2021-06,,성수동 대림미술관,,프랑스,프랑스,,에륭스의 헤리티지 전시회. 180년 역사를 가진 에륭스의 다양한 디자인 가방들을 묣로 전시. 사진 촬영이 자유로워 인증샷 명소로 주목받음.,2021,https://www.exclosetshop.com/trendnews/?bmode=view&idx=11301505
2025,까류띠에,까류띠에 타임 언리미티드 팝업전시회,럭셔리 주얼리/시계,,2023-06,2023-07,,성수동,,프랑스,프랑스,,까류띠에의 타임 언리미티드 팝업전시회. 성수동에서 진행된 럭셔리 주얼리 브랜드의 대표적인 팝업 행사.,2023,"https://www.news1.kr/industry/distribution/5204519, https://biz.newdaily.co.kr/site/data/html/2023/08/28/2023082800065.html"
2026,앱솔루트 보드카,앱솔루트 x 스티키몬스터랩 팝업스토어,주류/F&B,,2023-08,2023-09,,성수동 커먼그라운드,,스웨덴,스웨덴,,보드카 브랜드 앱솔루트와 국내 디자인 스튜디오 스티키몬스터랩의 컬래버레이션 팝업스토어. 약 한 달 동안 커먼그라운드에서 운영. 특색 있는 연출로 주목받음.,2023,https://hanquoclythu.com/2024/09/%EC%84%B1%EC%88%98%EB%8F%99-%ED%8C%9D%EC%97%85-%EC%8A%A4%ED%86%A0%EC%96%B4%EC%9D%98-%EC%84%B1%EC%A7%80/
2027,디즈니플러스,삼식이 삼촌 팝업스토어,OTT/엔터테인먼트,,2024-05,2024-06,,성수동 연무장길,,미국,미국,,디즈니플러스 오리지널 시리즈 '삼식이 삼촌(Uncle Samsik)' 공개를 앞둔 프로모션 팝업스토어. 빵집과 사무실 등 작품 속 배경을 그대로 구현. 성수 연무장길에서 운영.,2024,https://hanquoclythu.com/2024/09/%EC%84%B1%EC%88%98%EB%8F%99-%ED%8C%9D%EC%97%85-%EC%8A%A4%ED%86%A0%EC%96%B4%EC%9D%98-%EC%84%B1%EC%A7%80/
2028,이창섭(비투비),전과자 팝업스토어,엔터테인먼트/크리에이터,,2024,2024,,성수동,,한국,국내,,가수 이창섭의 유튜브 채널 '전과자' 세계관을 바탕으로 한 팝업스토어. 유튜브 채널 세계관을 오프라인으로 구현한 크리에이터 팝업의 대표 사례. 2024년 크리에이터 팝업 트렌드의 주요 예시.,2024,https://www.ksvalley.com/news/article.html?no=10351
2029,BJ랄랄,이명화 팝업스토어,엔터테인먼트/크리에이터,,2024,2024,,성수동,,한국,국내,,"BJ랄랄의 유튜브 채널 '이명화 유난 스토아'를 바탕으로 한 팝업스토어. 크리에이터 콘텐츠의 오프라인 확장 사례로, 2024년 크리에이터 팝업 트렌드를 대표하는 예시.",2024,https://www.thebk.co.kr/news/articleView.html?idxno=207863
2030,무신사(MUSINSA),무신나 슈즈 페스티벌 팝업,패션/의류,,2025-04-10,2025-04-13,,성수동,,한국,국내,,무신사의 슈즈 페스티벌 팝업 행사. 성수동에서 진행된 패션 브랜드의 대규모 팝업 이벤트. 신발 브랜드들을 한데 모아 축제 형태로 진행.,2025,https://jangsuh.com/entry/%EC%84%9C%EC%9A%B8-%EC%84%B1%EC%88%98%EC%97%AD-%EB%B6%80%EA%B7%BC-%ED%8C%9D%EC%97%85-%EC%8A%A4%ED%86%A0%EC%96%B4%EC%99%80-%EC%83%81%EA%B6%8C%EC%9D%84-%EB%8B%A4%EB%85%80%EC%99%80%EC%84%9C
2031,리벨라(Rivella),헬로 성수 마켓,식음료/F&B,,2026-04-23,2026-04-26,,성수동 이삭빌딩,,스위스,스위스,,"스위스 프리미엄 음료 브랜드 리벨라가 참여한 브랜드 연합 팝업스토어. '유럽을 마시며, 걷다'를 주제로 식음료와 패션, 뷰티, 예술 콘텐츠를 한 공간에 담은 체험형 팝업. 네로지아류니(슈즈), 오브엠(슈즈), 더파이(뷰티) 등 다양한 브랜드가 함께 참여.",,https://fashionbiz.co.kr/article/225698
2032,헬로 성수 마켓,헬로 성수 마켓 (Hello Seongsu Market),복합/라이프스타일,,2026-04-23,2026-04-26,,성수동 이삭빌딩,,한국/글로벌,한국/글로벌,,"브랜드 연합 팝업스토어로 식음료, 패션, 뷰티, 예술 콘텐츠를 한 공간에 담은 체험형 팝업. 리벨라(스위스 음료), 네로지아류니(이탈리아 슈즈), 오브엠(한국 슈즈), 더파이(뷰티) 등 참여. 1층에는 한정 포토부스, 2층에서는 청년 예술가 작품 전시 및 판매.",,https://fashionbiz.co.kr/article/225698
2033,커먼그라운드,커먼그라운드 팝업 쇼핑몰,복합/라이프스타일,,2015,상설,,성수동~걸대입구역 사이,,한국,국내,,200개의 컨테이너로 구성된 국내 최초 팝업 쇼핑몰. 2015년 오픈. K-pop 아티스트 팬 사인회 등 다양한 문화 행사 개최. 성수동의 대표적인 팝업 공간 플랫폼으로 대중교통 접근성과 넓은 면적이 장점.,2015,https://hanquoclythu.com/2024/09/%EC%84%B1%EC%88%98%EB%8F%99-%ED%8C%9D%EC%97%85-%EC%8A%A4%ED%86%A0%EC%96%B4%EC%9D%98-%EC%84%B1%EC%A7%80/
2034,에스팩토리(SFACTORY),에스팩토리 복합문화공간,복합/문화공간,,2016,상설,,성수동 연무장길,,한국,국내,,"1970년대 섬유공장, 체육관, 기숙사, 자동차 정비소 4개 건축물을 리모델링한 복합문화공간. 2016년 개관. 아트페어, 콘서트, 콘퍼런스 등 대규모 행사 주로 개최.",2016,https://hanquoclythu.com/2024/09/%EC%84%B1%EC%88%98%EB%8F%99-%ED%8C%9D%EC%97%85-%EC%8A%A4%ED%86%A0%EC%96%B4%EC%9D%98-%EC%84%B1%EC%A7%80/
2035,대림창고,대림창고 갤러리 카페,복합/문화공간,,2011,상설,,성수동,,한국,국내,,2011년 폐공장이던 대림창고가 창고형 갤러리 카페로 탈바꿈하며 성수동이 주목받게 된 앵커스토어. 붉은 벽돌 건축물이 성수의 상징이 됨. 성동구는 2017년 붉은벽돌건축물 보전 및 지원 조례 제정.,,https://www.kunews.ac.kr/news/articleView.html?idxno=42911
2036,입생로랑 뷰티,입생로랑 뷰티 러브스토어 팝업,뷰티/향수,,2024,2024,,성수동 연무장길 57 1층,,프랑스,프랑스,,입생로랑 뷰티의 러브스토어 팝업. 성수 연무장길에서 진행된 럭셔리 뷰티 브랜드의 대표적인 팝업스토어.,2024,https://dayforyou.com/getScheduleList
2037,스와로브스키,스와로브스키 마스터 오브 라이트 전시,뷰티/주얼리/전시,,2024-10,2024-10,,성수동,,오스트리아,오스트리아,,스와로브스키의 크리스털 아트 전시 팝업. 성수동에서 진행된 주얼리 브랜드의 대규모 전시 팝업.,2024,https://blog.naver.com/blk_lg_ryan/223633664761
2038,롱샴,롱샴 에너지 바이 롱샴 팝업,패션/가방,,2024,2024,,성수동,,프랑스,프랑스,,롱샴의 에너지 바이 롱샴 콘셉트 팝업스토어. 성수동에서 진행된 명품 가방 브랜드의 팝업.,2024,https://letter.wepick.kr/post/2077
2039,TEKLA,TEKLA 이구성수 팝업,패션/홈웨어,,2024,2024,,성수동 이구,,덴싸크,덴싸크,,TEKLA의 이구 성수 팝업스토어. 홈웨어와 라이프스타일 브랜드의 성수동 팝업.,2024,https://letter.wepick.kr/post/2077
2040,가비지타임,가비지타임 SCHOOL OF GARBAGE TIME 팝업,엔터테인먼트/웹툰,,2024,2024,,성수동,,한국,국내,,인기 웹툰 가비지타임을 주제로 한 팝업스토어. 웹툰 IP를 활용한 오프라인 체험 공간.,2024,https://letter.wepick.kr/post/2077
2041,브런치스토리,브런치스토리 작가의 여정 팝업,콘텐츠/출판,,2024,2024,,성수동,,한국,국내,,브런치스토리의 '작가의 여정' 콘셉트 팝업. 창작자 콘텐츠 기반 팝업스토어.,2024,https://letter.wepick.kr/post/2077
2042,타이레놀,타이레놀 T Magazine 팝업,제약/헬스케어,,2024,2024,,성수동,,미국,미국,,타이레놀의 T Magazine 콘셉트 팝업스토어. 헬스케어 브랜드의 이색적인 팝업 시도.,2024,https://letter.wepick.kr/post/2077
